,index,Unnamed: 0,name,nameLabel,education,educationLabel,countryLabel,isTrue,Questions,Statements,Group
1753,29559,30203,Q1285219,Foort van Oosten,Q156598,Leiden University,Netherlands,1,Did Foort van Oosten attend Leiden University?,Foort van Oosten attended Leiden University.,722
1754,29569,30214,Q1285501,Esther Benbassa,Q14567934,Grand Séminaire de Strasbourg,France,0,Did Esther Benbassa attend Grand Séminaire de Strasbourg?,Esther Benbassa attended Grand Séminaire de Strasbourg.,723
1755,29571,30216,Q1285501,Esther Benbassa,Q1430113,Institut national des langues et civilisations orientales,France,0,Did Esther Benbassa attend Institut national des langues et civilisations orientales?,Esther Benbassa attended Institut national des langues et civilisations orientales.,723
1756,29568,30212,Q1285501,Esther Benbassa,Q1476738,Catholic University of the West,France,0,Did Esther Benbassa attend Catholic University of the West?,Esther Benbassa attended Catholic University of the West.,723
1757,29567,30211,Q1285501,Esther Benbassa,Q571293,Sorbonne Nouvelle-Paris 3,France,1,Did Esther Benbassa attend Sorbonne Nouvelle-Paris 3?,Esther Benbassa attended Sorbonne Nouvelle-Paris 3.,723
1758,29566,30210,Q1285501,Esther Benbassa,Q319239,Tel Aviv University,Israel,1,Did Esther Benbassa attend Tel Aviv University?,Esther Benbassa attended Tel Aviv University.,723
1759,29565,30209,Q1285501,Esther Benbassa,Q1194988,Paris 8 University,France,1,Did Esther Benbassa attend Paris 8 University?,Esther Benbassa attended Paris 8 University.,723
1760,29662,30312,Q1285630,Marlyn Glen,Q935290,"University of Wales, Newport",United Kingdom,0,"Did Marlyn Glen attend University of Wales, Newport?","Marlyn Glen attended University of Wales, Newport.",724
1761,29663,30313,Q1285630,Marlyn Glen,Q1534573,Staffordshire University,United Kingdom,0,Did Marlyn Glen attend Staffordshire University?,Marlyn Glen attended Staffordshire University.,724
1762,29659,30309,Q1285630,Marlyn Glen,Q216273,University of St Andrews,United Kingdom,1,Did Marlyn Glen attend University of St Andrews?,Marlyn Glen attended University of St Andrews.,724
1763,29658,30308,Q1285630,Marlyn Glen,Q2413375,The Open University,United Kingdom,1,Did Marlyn Glen attend The Open University?,Marlyn Glen attended The Open University.,724
1764,6104,6300,Q128573,Ichirō Matsui,Q4803373,Asahi University,Japan,0,Did Ichirō Matsui attend Asahi University?,Ichirō Matsui attended Asahi University.,725
1765,6101,6297,Q128573,Ichirō Matsui,Q1446492,Fukuoka Institute of Technology,Japan,1,Did Ichirō Matsui attend Fukuoka Institute of Technology?,Ichirō Matsui attended Fukuoka Institute of Technology.,725
1766,29670,30320,Q1285765,Salvatore Barbaro,Q414258,Academy of Performing Arts Baden-Wuerttemberg,Germany,0,Did Salvatore Barbaro attend Academy of Performing Arts Baden-Wuerttemberg?,Salvatore Barbaro attended Academy of Performing Arts Baden-Wuerttemberg.,726
1767,29665,30315,Q1285765,Salvatore Barbaro,Q152838,University of Göttingen,Germany,1,Did Salvatore Barbaro attend University of Göttingen?,Salvatore Barbaro attended University of Göttingen.,726
1768,29672,30322,Q1286695,Steve Rothman,Q1075148,"University of California, Riverside",United States of America,0,"Did Steve Rothman attend University of California, Riverside?","Steve Rothman attended University of California, Riverside.",727
1769,29671,30321,Q1286695,Steve Rothman,Q617433,Syracuse University,United States of America,1,Did Steve Rothman attend Syracuse University?,Steve Rothman attended Syracuse University.,727
1770,181,183,Q12869,Kris Peeters,Q1781858,Hasselt University,Belgium,0,Did Kris Peeters attend Hasselt University?,Kris Peeters attended Hasselt University.,728
1771,180,182,Q12869,Kris Peeters,Q175241,University of Antwerp,Belgium,1,Did Kris Peeters attend University of Antwerp?,Kris Peeters attended University of Antwerp.,728
1772,29717,30368,Q1286949,Gabriella Selmeczi,Q693351,Debrecen Reformed Theological University,Hungary,0,Did Gabriella Selmeczi attend Debrecen Reformed Theological University?,Gabriella Selmeczi attended Debrecen Reformed Theological University.,729
1773,29713,30364,Q1286949,Gabriella Selmeczi,Q255285,Pázmány Péter Catholic University,Hungary,1,Did Gabriella Selmeczi attend Pázmány Péter Catholic University?,Gabriella Selmeczi attended Pázmány Péter Catholic University.,729
1774,29722,30374,Q1287098,Edmundas Pupinis,Q1247342,Mykolas Romeris University,Lithuania,0,Did Edmundas Pupinis attend Mykolas Romeris University?,Edmundas Pupinis attended Mykolas Romeris University.,730
1775,29719,30370,Q1287098,Edmundas Pupinis,Q1479914,Vytautas Magnus University Agriculture Academy,Lithuania,1,Did Edmundas Pupinis attend Vytautas Magnus University Agriculture Academy?,Edmundas Pupinis attended Vytautas Magnus University Agriculture Academy.,730
1776,29725,30377,Q1287239,Nils Ušakovs,Q1342858,Latvia University of Life Sciences and Technologies,Latvia,0,Did Nils Ušakovs attend Latvia University of Life Sciences and Technologies?,Nils Ušakovs attended Latvia University of Life Sciences and Technologies.,731
1777,29724,30376,Q1287239,Nils Ušakovs,Q498407,University of Latvia,Latvia,1,Did Nils Ušakovs attend University of Latvia?,Nils Ušakovs attended University of Latvia.,731
1778,29731,30383,Q1287344,Ivica Kirin,Q5428923,"Faculty of Civil Engineering, University of Osijek",Croatia,0,"Did Ivica Kirin attend Faculty of Civil Engineering, University of Osijek?","Ivica Kirin attended Faculty of Civil Engineering, University of Osijek.",732
1779,29730,30382,Q1287344,Ivica Kirin,Q675848,University of Zagreb,Croatia,1,Did Ivica Kirin attend University of Zagreb?,Ivica Kirin attended University of Zagreb.,732
1780,29739,30391,Q1287635,Neel Kashkari,Q1171185,University of Hawaiʻi–West Oʻahu,United States of America,0,Did Neel Kashkari attend University of Hawaiʻi–West Oʻahu?,Neel Kashkari attended University of Hawaiʻi–West Oʻahu.,733
1781,29742,30394,Q1287635,Neel Kashkari,Q7896415,University of Tennessee College of Dentistry,United States of America,0,Did Neel Kashkari attend University of Tennessee College of Dentistry?,Neel Kashkari attended University of Tennessee College of Dentistry.,733
1782,29736,30388,Q1287635,Neel Kashkari,Q1329269,The Wharton School,United States of America,1,Did Neel Kashkari attend The Wharton School?,Neel Kashkari attended The Wharton School.,733
1783,29737,30389,Q1287635,Neel Kashkari,Q457281,University of Illinois at Urbana–Champaign,United States of America,1,Did Neel Kashkari attend University of Illinois at Urbana–Champaign?,Neel Kashkari attended University of Illinois at Urbana–Champaign.,733
1784,29748,30400,Q1287955,Martin Dörmann,Q122577611,University of Cooperative Education Melle,Germany,0,Did Martin Dörmann attend University of Cooperative Education Melle?,Martin Dörmann attended University of Cooperative Education Melle.,734
1785,29743,30395,Q1287955,Martin Dörmann,Q54096,University of Cologne,Germany,1,Did Martin Dörmann attend University of Cologne?,Martin Dörmann attended University of Cologne.,734
1786,29806,30461,Q1288461,István Simicskó,Q105046525,St. Gerard Bible College,Hungary,0,Did István Simicskó attend St. Gerard Bible College?,István Simicskó attended St. Gerard Bible College.,735
1787,29805,30460,Q1288461,István Simicskó,Q1467882,Miklós Zrínyi National Defense University,Hungary,1,Did István Simicskó attend Miklós Zrínyi National Defense University?,István Simicskó attended Miklós Zrínyi National Defense University.,735
1788,29816,30471,Q1288810,Nancy Faeser,Q158158,TU Dresden,Germany,0,Did Nancy Faeser attend TU Dresden?,Nancy Faeser attended TU Dresden.,736
1789,29811,30466,Q1288810,Nancy Faeser,Q50662,Goethe University Frankfurt,Germany,1,Did Nancy Faeser attend Goethe University Frankfurt?,Nancy Faeser attended Goethe University Frankfurt.,736
1790,29818,30473,Q1288930,Nenad Čanak,Q118185578,University Business Academy,Serbia,0,Did Nenad Čanak attend University Business Academy?,Nenad Čanak attended University Business Academy.,737
1791,29817,30472,Q1288930,Nenad Čanak,Q1263535,University of Novi Sad,Serbia,1,Did Nenad Čanak attend University of Novi Sad?,Nenad Čanak attended University of Novi Sad.,737
1792,6112,6308,Q128922,Leonid Chernovetskyi,Q20077845,"21 Sheptytskoho Square, Ivano-Frankivsk",Ukraine,0,"Did Leonid Chernovetskyi attend 21 Sheptytskoho Square, Ivano-Frankivsk?","Leonid Chernovetskyi attended 21 Sheptytskoho Square, Ivano-Frankivsk.",738
1793,6107,6303,Q128922,Leonid Chernovetskyi,Q4314896,National University “Yaroslav the Wise Law Academy of Ukraine”,Ukraine,1,Did Leonid Chernovetskyi attend National University “Yaroslav the Wise Law Academy of Ukraine”?,Leonid Chernovetskyi attended National University “Yaroslav the Wise Law Academy of Ukraine”.,738
1794,6116,6312,Q128933,Michaëlle Jean,Q1689439,University of Lethbridge,Canada,0,Did Michaëlle Jean attend University of Lethbridge?,Michaëlle Jean attended University of Lethbridge.,739
1795,6117,6313,Q128933,Michaëlle Jean,Q99387936,Grand Séminaire de Rimouski,Canada,0,Did Michaëlle Jean attend Grand Séminaire de Rimouski?,Michaëlle Jean attended Grand Séminaire de Rimouski.,739
1796,6118,6314,Q128933,Michaëlle Jean,Q7058654,Northern Lights College,Canada,0,Did Michaëlle Jean attend Northern Lights College?,Michaëlle Jean attended Northern Lights College.,739
1797,6114,6310,Q128933,Michaëlle Jean,Q392189,Université de Montréal,Canada,1,Did Michaëlle Jean attend Université de Montréal?,Michaëlle Jean attended Université de Montréal.,739
1798,6115,6311,Q128933,Michaëlle Jean,Q820887,University of Florence,Italy,1,Did Michaëlle Jean attend University of Florence?,Michaëlle Jean attended University of Florence.,739
1799,6113,6309,Q128933,Michaëlle Jean,Q748085,University of Perugia,Italy,1,Did Michaëlle Jean attend University of Perugia?,Michaëlle Jean attended University of Perugia.,739
1800,29959,30618,Q1289595,Tamás Sneider,Q281572,Andrássy University Budapest,Hungary,0,Did Tamás Sneider attend Andrássy University Budapest?,Tamás Sneider attended Andrássy University Budapest.,740
1801,29958,30617,Q1289595,Tamás Sneider,Q991872,Eszterházy Károly Catholic University,Hungary,1,Did Tamás Sneider attend Eszterházy Károly Catholic University?,Tamás Sneider attended Eszterházy Károly Catholic University.,740
1802,29964,30624,Q1289864,Eduard Schock,Q2088264,Philosophisch-Theologische Hochschule Heiligenkreuz,Austria,0,Did Eduard Schock attend Philosophisch-Theologische Hochschule Heiligenkreuz?,Eduard Schock attended Philosophisch-Theologische Hochschule Heiligenkreuz.,741
1803,29963,30623,Q1289864,Eduard Schock,Q165980,University of Vienna,Austria,1,Did Eduard Schock attend University of Vienna?,Eduard Schock attended University of Vienna.,741
1804,29971,30631,Q1289901,Harold Ford Jr.,Q915866,Chicago State University,United States of America,0,Did Harold Ford Jr. attend Chicago State University?,Harold Ford Jr. attended Chicago State University.,742
1805,29975,30635,Q1289901,Harold Ford Jr.,Q7847734,Truman State University,United States of America,0,Did Harold Ford Jr. attend Truman State University?,Harold Ford Jr. attended Truman State University.,742
1806,29970,30630,Q1289901,Harold Ford Jr.,Q230492,University of Michigan,United States of America,1,Did Harold Ford Jr. attend University of Michigan?,Harold Ford Jr. attended University of Michigan.,742
1807,29969,30629,Q1289901,Harold Ford Jr.,Q49117,University of Pennsylvania,United States of America,1,Did Harold Ford Jr. attend University of Pennsylvania?,Harold Ford Jr. attended University of Pennsylvania.,742
1808,30113,30778,Q1290169,Sulejman Ugljanin,Q6048890,International Burch University,Bosnia and Herzegovina,0,Did Sulejman Ugljanin attend International Burch University?,Sulejman Ugljanin attended International Burch University.,743
1809,30109,30774,Q1290169,Sulejman Ugljanin,Q572286,University of Sarajevo,Bosnia and Herzegovina,1,Did Sulejman Ugljanin attend University of Sarajevo?,Sulejman Ugljanin attended University of Sarajevo.,743
1810,30119,30784,Q1290408,Sorina-Luminița Plăcintă,Q1475400,Transilvania University of Brașov,Romania,0,Did Sorina-Luminița Plăcintă attend Transilvania University of Brașov?,Sorina-Luminița Plăcintă attended Transilvania University of Brașov.,744
1811,30115,30780,Q1290408,Sorina-Luminița Plăcintă,Q458666,Gheorghe Asachi Technical University of Iași,Romania,1,Did Sorina-Luminița Plăcintă attend Gheorghe Asachi Technical University of Iași?,Sorina-Luminița Plăcintă attended Gheorghe Asachi Technical University of Iași.,744
1812,30125,30790,Q1290543,Kálmán Soós,Q4271095,Danylo Halytsky Lviv National Medical University,Austrian Empire,0,Did Kálmán Soós attend Danylo Halytsky Lviv National Medical University?,Kálmán Soós attended Danylo Halytsky Lviv National Medical University.,745
1813,30121,30786,Q1290543,Kálmán Soós,Q4469637,Uzhhorod National University,Ukraine,1,Did Kálmán Soós attend Uzhhorod National University?,Kálmán Soós attended Uzhhorod National University.,745
1814,187,189,Q12911,Christopher Loeak,Q16973001,"University of California, Irvine School of Humanities",United States of America,0,"Did Christopher Loeak attend University of California, Irvine School of Humanities?","Christopher Loeak attended University of California, Irvine School of Humanities.",746
1815,186,188,Q12911,Christopher Loeak,Q1591615,Hawaii Pacific University,United States of America,1,Did Christopher Loeak attend Hawaii Pacific University?,Christopher Loeak attended Hawaii Pacific University.,746
1816,197,199,Q12914,Kessai Note,Q7133170,Papua New Guinea University of Natural Resources and Environment,Papua New Guinea,0,Did Kessai Note attend Papua New Guinea University of Natural Resources and Environment?,Kessai Note attended Papua New Guinea University of Natural Resources and Environment.,747
1817,192,194,Q12914,Kessai Note,Q780975,University of Papua New Guinea,Papua New Guinea,1,Did Kessai Note attend University of Papua New Guinea?,Kessai Note attended University of Papua New Guinea.,747
1818,30240,30906,Q1291415,Edvardas Žakaris,Q7931197,Vilnius University Faculty of Communication,Lithuania,0,Did Edvardas Žakaris attend Vilnius University Faculty of Communication?,Edvardas Žakaris attended Vilnius University Faculty of Communication.,748
1819,30235,30901,Q1291415,Edvardas Žakaris,Q1479914,Vytautas Magnus University Agriculture Academy,Lithuania,1,Did Edvardas Žakaris attend Vytautas Magnus University Agriculture Academy?,Edvardas Žakaris attended Vytautas Magnus University Agriculture Academy.,748
1820,30243,30909,Q1291489,Ed Pease,Q2166712,Rose–Hulman Institute of Technology,United States of America,0,Did Ed Pease attend Rose–Hulman Institute of Technology?,Ed Pease attended Rose–Hulman Institute of Technology.,749
1821,30241,30907,Q1291489,Ed Pease,Q666128,Indiana State University,United States of America,1,Did Ed Pease attend Indiana State University?,Ed Pease attended Indiana State University.,749
1822,30250,30916,Q1292183,Tamás Suchman,Q987722,Edutus University,Hungary,0,Did Tamás Suchman attend Edutus University?,Tamás Suchman attended Edutus University.,750
1823,30247,30913,Q1292183,Tamás Suchman,Q1187444,University of Pécs,Hungary,1,Did Tamás Suchman attend University of Pécs?,Tamás Suchman attended University of Pécs.,750
1824,203,205,Q12927,Marine Le Pen,Q572968,University of Pau and Pays de l'Adour,France,0,Did Marine Le Pen attend University of Pau and Pays de l'Adour?,Marine Le Pen attended University of Pau and Pays de l'Adour.,751
1825,198,200,Q12927,Marine Le Pen,Q662976,Panthéon-Assas University,France,1,Did Marine Le Pen attend Panthéon-Assas University?,Marine Le Pen attended Panthéon-Assas University.,751
1826,205,208,Q12932,Olivier Besancenot,Q1477551,Université Catholique de Lille,France,0,Did Olivier Besancenot attend Université Catholique de Lille?,Olivier Besancenot attended Université Catholique de Lille.,752
1827,204,206,Q12932,Olivier Besancenot,Q1394262,Paris Nanterre University,France,1,Did Olivier Besancenot attend Paris Nanterre University?,Olivier Besancenot attended Paris Nanterre University.,752
1828,30388,31058,Q1293535,Gábor Szabó,Q255285,Pázmány Péter Catholic University,Hungary,0,Did Gábor Szabó attend Pázmány Péter Catholic University?,Gábor Szabó attended Pázmány Péter Catholic University.,753
1829,30387,31057,Q1293535,Gábor Szabó,Q1123379,Károli Gáspár University of the Reformed Church in Hungary,Hungary,1,Did Gábor Szabó attend Károli Gáspár University of the Reformed Church in Hungary?,Gábor Szabó attended Károli Gáspár University of the Reformed Church in Hungary.,753
1830,30394,31064,Q1293660,Edward Skyler,Q1276963,Sacred Heart University,United States of America,0,Did Edward Skyler attend Sacred Heart University?,Edward Skyler attended Sacred Heart University.,754
1831,30393,31063,Q1293660,Edward Skyler,Q49117,University of Pennsylvania,United States of America,1,Did Edward Skyler attend University of Pennsylvania?,Edward Skyler attended University of Pennsylvania.,754
1832,29684,30334,Q1294150,Edward Wojtas,Q5147001,Collegium Civitas,Poland,0,Did Edward Wojtas attend Collegium Civitas?,Edward Wojtas attended Collegium Civitas.,755
1833,29683,30333,Q1294150,Edward Wojtas,Q1613719,Maria Curie-Skłodowska University,Poland,1,Did Edward Wojtas attend Maria Curie-Skłodowska University?,Edward Wojtas attended Maria Curie-Skłodowska University.,755
1834,29695,30345,Q1294268,Ferenc Szalay,Q18599934,Theological College of Eger,Hungary,0,Did Ferenc Szalay attend Theological College of Eger?,Ferenc Szalay attended Theological College of Eger.,756
1835,29692,30342,Q1294268,Ferenc Szalay,Q1187444,University of Pécs,Hungary,0,Did Ferenc Szalay attend University of Pécs?,Ferenc Szalay attended University of Pécs.,756
1836,29689,30339,Q1294268,Ferenc Szalay,Q1287034,Hungarian University of Sports Science,Hungary,1,Did Ferenc Szalay attend Hungarian University of Sports Science?,Ferenc Szalay attended Hungarian University of Sports Science.,756
1837,29690,30340,Q1294268,Ferenc Szalay,Q991872,Eszterházy Károly Catholic University,Hungary,1,Did Ferenc Szalay attend Eszterházy Károly Catholic University?,Ferenc Szalay attended Eszterházy Károly Catholic University.,756
1838,6402,6606,Q129451,Augustin Legrand,Q105809850,National Polytechnic Institute of Clermont Auvergne,France,0,Did Augustin Legrand attend National Polytechnic Institute of Clermont Auvergne?,Augustin Legrand attended National Polytechnic Institute of Clermont Auvergne.,757
1839,6401,6605,Q129451,Augustin Legrand,Q662976,Panthéon-Assas University,France,1,Did Augustin Legrand attend Panthéon-Assas University?,Augustin Legrand attended Panthéon-Assas University.,757
1840,212,215,Q12961,Nicolas Dupont-Aignan,Q3268864,Lycee Notre-Dame Saint-Sigisbert,France,0,Did Nicolas Dupont-Aignan attend Lycee Notre-Dame Saint-Sigisbert?,Nicolas Dupont-Aignan attended Lycee Notre-Dame Saint-Sigisbert.,758
1841,213,216,Q12961,Nicolas Dupont-Aignan,Q3152698,Institut universitaire de technologie de Lannion,France,0,Did Nicolas Dupont-Aignan attend Institut universitaire de technologie de Lannion?,Nicolas Dupont-Aignan attended Institut universitaire de technologie de Lannion.,758
1842,210,213,Q12961,Nicolas Dupont-Aignan,Q859363,Sciences Po,France,1,Did Nicolas Dupont-Aignan attend Sciences Po?,Nicolas Dupont-Aignan attended Sciences Po.,758
1843,209,212,Q12961,Nicolas Dupont-Aignan,Q1546437,Paris Dauphine University,France,1,Did Nicolas Dupont-Aignan attend Paris Dauphine University?,Nicolas Dupont-Aignan attended Paris Dauphine University.,758
1844,217,222,Q12963,François Bayrou,Q1381437,University of Auvergne - Clermont I,France,0,Did François Bayrou attend University of Auvergne - Clermont I?,François Bayrou attended University of Auvergne - Clermont I.,759
1845,215,219,Q12963,François Bayrou,Q13342,Bordeaux Montaigne University,France,1,Did François Bayrou attend Bordeaux Montaigne University?,François Bayrou attended Bordeaux Montaigne University.,759
1846,221,226,Q12964,François-Xavier Villain,Q259388,University of Nantes,France,0,Did François-Xavier Villain attend University of Nantes?,François-Xavier Villain attended University of Nantes.,760
1847,220,225,Q12964,François-Xavier Villain,Q859363,Sciences Po,France,1,Did François-Xavier Villain attend Sciences Po?,François-Xavier Villain attended Sciences Po.,760
1848,29780,30434,Q1297365,Victor Shenderovich,Q4081726,Belgorod State Technological University,Russia,0,Did Victor Shenderovich attend Belgorod State Technological University?,Victor Shenderovich attended Belgorod State Technological University.,761
1849,29779,30433,Q1297365,Victor Shenderovich,Q4304098,Moscow State Institute of Culture,Russia,1,Did Victor Shenderovich attend Moscow State Institute of Culture?,Victor Shenderovich attended Moscow State Institute of Culture.,761
1850,228,236,Q12978,Guy Verhofstadt,Q14510915,Universitaire Faculteiten Sint-Ignatius Antwerpen,Belgium,0,Did Guy Verhofstadt attend Universitaire Faculteiten Sint-Ignatius Antwerpen?,Guy Verhofstadt attended Universitaire Faculteiten Sint-Ignatius Antwerpen.,762
1851,224,231,Q12978,Guy Verhofstadt,Q1137665,Ghent University,Belgium,1,Did Guy Verhofstadt attend Ghent University?,Guy Verhofstadt attended Ghent University.,762
1852,234,242,Q12981,Yves Leterme,Q2668892,Transnational University Limburg,Belgium,0,Did Yves Leterme attend Transnational University Limburg?,Yves Leterme attended Transnational University Limburg.,763
1853,233,241,Q12981,Yves Leterme,Q644789,Catholic University of Leuven,Belgium,0,Did Yves Leterme attend Catholic University of Leuven?,Yves Leterme attended Catholic University of Leuven.,763
1854,229,237,Q12981,Yves Leterme,Q833670,Katholieke Universiteit Leuven,Belgium,1,Did Yves Leterme attend Katholieke Universiteit Leuven?,Yves Leterme attended Katholieke Universiteit Leuven.,763
1855,230,238,Q12981,Yves Leterme,Q1137665,Ghent University,Belgium,1,Did Yves Leterme attend Ghent University?,Yves Leterme attended Ghent University.,763
1856,29789,30444,Q1298561,Zsolt Szilágyi,Q296709,Oil & Gas University of Ploiești,Romania,0,Did Zsolt Szilágyi attend Oil & Gas University of Ploiești?,Zsolt Szilágyi attended Oil & Gas University of Ploiești.,764
1857,29785,30439,Q1298561,Zsolt Szilágyi,Q1475126,Politehnica University of Timișoara,Romania,1,Did Zsolt Szilágyi attend Politehnica University of Timișoara?,Zsolt Szilágyi attended Politehnica University of Timișoara.,764
1858,29877,30534,Q1299042,Elbert Dijkgraaf,Q1407397,Open University of the Netherlands,Netherlands,0,Did Elbert Dijkgraaf attend Open University of the Netherlands?,Elbert Dijkgraaf attended Open University of the Netherlands.,765
1859,29875,30532,Q1299042,Elbert Dijkgraaf,Q633529,Erasmus University Rotterdam,Netherlands,1,Did Elbert Dijkgraaf attend Erasmus University Rotterdam?,Elbert Dijkgraaf attended Erasmus University Rotterdam.,765
1860,29884,30541,Q1299043,Péter Szitka,Q61187321,Medical University of Pécs,Hungary,0,Did Péter Szitka attend Medical University of Pécs?,Péter Szitka attended Medical University of Pécs.,766
1861,29881,30538,Q1299043,Péter Szitka,Q729786,University of Miskolc,Hungary,1,Did Péter Szitka attend University of Miskolc?,Péter Szitka attended University of Miskolc.,766
1862,29890,30548,Q1299331,Ieremia Tabai,Q7981425,Wellington Institute of Technology,New Zealand,0,Did Ieremia Tabai attend Wellington Institute of Technology?,Ieremia Tabai attended Wellington Institute of Technology.,767
1863,29886,30544,Q1299331,Ieremia Tabai,Q1150437,Victoria University of Wellington,New Zealand,1,Did Ieremia Tabai attend Victoria University of Wellington?,Ieremia Tabai attended Victoria University of Wellington.,767
1864,6408,6612,Q130079,David Wu,Q65379,Virginia Tech,United States of America,0,Did David Wu attend Virginia Tech?,David Wu attended Virginia Tech.,768
1865,6407,6611,Q130079,David Wu,Q41506,Stanford University,United States of America,1,Did David Wu attend Stanford University?,David Wu attended Stanford University.,768
1866,29895,30553,Q1301175,Eibhlin Byrne,Q6549261,Limerick Institute of Technology,Republic of Ireland,0,Did Eibhlin Byrne attend Limerick Institute of Technology?,Eibhlin Byrne attended Limerick Institute of Technology.,769
1867,29892,30550,Q1301175,Eibhlin Byrne,Q1068258,University College Dublin,Republic of Ireland,1,Did Eibhlin Byrne attend University College Dublin?,Eibhlin Byrne attended University College Dublin.,769
1868,29900,30558,Q1301603,László Szászfalvi,Q65589756,University of Buda,Hungary,0,Did László Szászfalvi attend University of Buda?,László Szászfalvi attended University of Buda.,770
1869,29898,30556,Q1301603,László Szászfalvi,Q1123379,Károli Gáspár University of the Reformed Church in Hungary,Hungary,1,Did László Szászfalvi attend Károli Gáspár University of the Reformed Church in Hungary?,László Szászfalvi attended Károli Gáspár University of the Reformed Church in Hungary.,770
1870,30034,30696,Q1301751,István Szávay,Q1123379,Károli Gáspár University of the Reformed Church in Hungary,Hungary,0,Did István Szávay attend Károli Gáspár University of the Reformed Church in Hungary?,István Szávay attended Károli Gáspár University of the Reformed Church in Hungary.,771
1871,30031,30693,Q1301751,István Szávay,Q12815487,National University of Public Service,Hungary,1,Did István Szávay attend National University of Public Service?,István Szávay attended National University of Public Service.,771
1872,30038,30700,Q1303740,Eike Hallitzky,Q1388301,FH Aachen,Germany,0,Did Eike Hallitzky attend FH Aachen?,Eike Hallitzky attended FH Aachen.,772
